### ISSUE TITLE
No response to MPS port accessing over L3 router while from same L2 domain works fine.

### ISSUE THREAD

**Issue by naoyukimori** [Ylianst/MeshCentral#1905]
I've deployed MeshCentral at DMZ.
HTTPS web service access works fine behind HTTPS/TLS reverse proxy.
However, MPS service has reachability issue.
Can somebody help me?

On UTM(Sophos; router + firewall + reverse proxy in one box), I've configured to reverse proxy for port 4430, terminating TLS and forward MeshCentral w/ decrypted HTTP.
For MPS port 4433, just enabled DNAT and pass though firewall. i.e. no reverse proxy enabled since MPS is binary stream protocol (not HTTP based one that cannot handle w/ Sophos).
Also enabled hairpin NAT to enable internal machine access w/ external IP.

When target machine is inside LAN, it works fine for both HTTPS web access and AMT access through MeshCentral web.
However, once target machine moved to WAN, only MPS traffic is blocked.
It seems MeshCentral process doesn't accept L3 routed MPS packets at all. Same broadcast domain L2 packet is accepted.
I guess some additional configuration may required but in stuck...

MeshCentral server ver 0.6.65: 192.168.2.3:4433
Router LAN: 192.168.2.1
AMT machine at LAN: 192.168.2.8
AMT machine at WAN: 106.x.y.z

Relevant config.json:
```
{
  "settings": {
    "Cert": "example.com",
    "Port": 4430,
    "AliasPort": 4430,
    "RedirPort": 0,
    "TlsOffload": "192.168.2.1",
    "MpsPort": 4433,
    "AliasMpsPort": 4433
  },
  "domains": {
    "": {
      "certUrl": "https://example.com:443/"
    }
}
```
tcpudump:
MPS CIRA access from WAN: **issue here**
21:27:59.877288 IP 106.x.y.z.16993 > 192.168.2.3.4433: Flags [S], seq 2505178796, win 8688, options [mss 1380,nop,wscale 0,nop,nop,TS val 751272 ecr 0], length 0  **No response against SYN packet**
21:28:02.174565 IP 106.x.y.z.16993 > 192.168.2.3.4433: Flags [S], seq 2505178796, win 8688, options [mss 1380,nop,wscale 0,nop,nop,TS val 754274 ecr 0], length 0   **retry happened! won't work further**

MPS CIRA access from LAN as if accessing external MeshCentral but hair pined back to internal same L2 domain MeshCentral server: works fine
_18:29:02.352563 IP 192.168.2.1.16995 > 192.168.2.3.4433: Flags [S], seq 516217592, win 8688, options [mss 1460,nop,wscale 0,nop,nop,TS val 250884 ecr 0], length 0   **Router 192.168.2.1 NAT'ed and forward to MeshCentral server 192.168.2.3**
18:29:02.352678 IP 192.168.2.3.4433 > 192.168.2.1.16995: Flags [S.], seq 3572019390, ack 516217593, win 65535, options [mss 1460,nop,wscale 6,nop,nop,TS val 275906736 ecr 250884], length 0   **TCP handshake started**

Similar to above, but disabled home domain(environment detection) to make direct connect from AMT to MeshCentral server: works fine
_17:59:08.789802 IP 192.168.2.8.43868 > 192.168.2.3.4433: Flags [S], seq 2353460520, win 29200, options [mss 1460,nop,nop,sackOK,nop,wscale 6], length 0
17:59:08.789954 IP 192.168.2.3.4433 > 192.168.2.8.43868: Flags [S.], seq 2135147162, ack 2353460521, win 65535, options [mss 1460,nop,wscale 6,sackOK,eol], length 0

Port open status of MeshCentral process:
$ netstat -an|grep "443[0,3]
tcp46      0      0  *.4430                 *.*                    LISTEN     
tcp46      0      0  *.4433                 *.*                    LISTEN     

$lsof -a -i:4430 and lsof -a -i:4433
COMMAND   PID        USER   FD   TYPE             DEVICE SIZE/OFF NODE NAME
node    46338 meshcentral   15u  IPv6 0x4f350182dc2a000d      0t0  TCP *:4430 (LISTEN)
node    46338 meshcentral   17u  IPv6 0x4f350182dc2a33cd      0t0  TCP *:4433 (LISTEN)

Tried "mpsTlsOffload: false", but in vain.

Thanks in advance,
Mori

**Comment by vitko-bg** [comment]
Hi. Why "Port" and "AliasPort" are the same?
I do not think it is designed to work that way.....
Also "MpsPort" and "AliasMpsPort"
Try to make config as per documentation

**Comment by naoyukimori** [comment]
I tried removing AliasMpsPort, but no change.
Pls have a look of diagram below.
Router and MeshCentral server are different host, have different IP address, so we can use same port number.
Correct me if it's wrong.

![MeshCentral proxy_config diagram](https://user-images.githubusercontent.com/5636510/96757844-f6591e80-1410-11eb-8a03-19d4e8c13a43.png)

**Comment by Ylianst** [comment]
I really like the graphic! First, I want to note that MeshCentral v0.6.66 is going to have much improved Intel AMT activation and configuration support. I am doing away with the ".mescript" and instead there is a new system to activate and configure Intel AMT using the WSMAN stack in the server. It's really amazing. I can't wait to show it off.

For the two alias ports in the config.json, if they are the same as the port they make no difference, so you can remove them.

```
{
  "settings": {
    "Cert": "example.com",
    "Port": 4430,
    "AliasPort": 4430,        <-----
    "RedirPort": 0,
    "TlsOffload": "192.168.2.1",
    "MpsPort": 4433,
    "AliasMpsPort": 4433       <-----
  },
  "domains": {
    "": {
      "certUrl": "https://example.com:443/"
    }
}
```

If you have ports numbers in front of your router that there different from the port on the server, you would need to specify the alias port, but since they are the same, it makes no difference.

![image](https://user-images.githubusercontent.com/1319013/96807001-61cbcd80-13ca-11eb-8987-09227ce9182d.png)

Looking at the real problem now...

**Comment by Ylianst** [comment]
You have a nice setup, I like to you enabled hairpin routing. 

Intel AMT will expect to connect to the MPS server and see a specific TLS certificate that will be presented by MeshCentral on port 4433. Can you make sure that your DNAT does not do TLS?

If you do want to have the router also do TLS, you will need to use the MPS certificate that is located in "meshcentral-data", these files:

```
mpsserver-cert-public.crt
mpsserver-cert-private.key
```

Then, you can also add `"mpsTlsOffload": true` so that MeshCentral does not do TLS on port 4433.

Anyway, I have another test for you. The MPS server on port 4433 understands binary for the CIRA protocol, but if you send an HTTP request, it will answer. This is not normal, but I added this for debugging. Try going to your server with a browser with `https://server:4433`. You can get a warning that the certificate is bad, but if you say ok to the warning, you will see this:

![image](https://user-images.githubusercontent.com/1319013/96807696-16b2ba00-13cc-11eb-8588-a446f3955123.png)

Can you try with your browser and let me know if it works? Thanks.

**Comment by naoyukimori** [comment]
Hi Ylianst,

Thanks for looking this.
Actually, for MPS traffic, router does not touch byte stream nor don't care about TLS. It's transparent plain NAT routing function enabled. I've confirmed MPS traffic is TLS type by Wireshark packet capture. Reason is that my router Sophos cannot terminate TLS portion only, but it should involve HTTP protocol on top TLS, so far I checked product manual. 
That's why MPS traffic is just simply routed while HTTPS traffic is TLS terminated by router's reverse proxy function.
I've checked accessing `https://server:4433` from web browser running on AMT machine **2**, it shows same message you showed w/ certificated issue by MeshCentral. (hairpin NAT'ed access in this case)
If I access from AMT machine **1**, it doesn't show anything, because TCP connection cannot be established at all, as I presented first message tcpdump log. No SYN ACK packet from MeshCentral against first SYN packet from AMT machine 1.
Attached modified diagram below.

![MeshCentral proxy_config diagram 2](https://user-images.githubusercontent.com/5636510/96827718-20422d80-1471-11eb-9b38-4f9aec8574b3.png)

**Comment by Ylianst** [comment]
The only thing I can think about it that there is a firewall issue on MeshCentral server. MeshCentral is built in NodeJS and I don't generally control the TCP stack of the operating system. One thing you can do is to go in the "My Server" - > "Trace" tab and turn on tracing for Intel AMT and see there are any errors.

![image](https://user-images.githubusercontent.com/1319013/96833248-f8ad7f80-13f4-11eb-8c27-12ebe64c034f.png)

However, if you replace port 4433 on MeshCentral with a regular web server and it still does not work, I and not sure this is a MeshCentral related issue, I am at a loss to understand what is going on.

**Comment by naoyukimori** [comment]
I've already tried enabled this server tracing but nothing show up when client tried to connect MPS service...

Yeah, I doubt it's either firewall or OS's TCP/IP stack issue.
My Guess is packet is broken by firewall or some reason that OS's network stack drop that TCP SYN packet.
I checked socket status w/ netstat and lsof. Result shows MeshCentral node process open both port and place LISTEN status.
If you give me some pointer of source where the actual BSD socket accept() call issued for MPS, then I would try to debug it.
Weird thing is even HTTP 4430 port is same "LISTEN" status w/ MPS 4433 but only MPS port has issue.
Another service such as IMAPS is running well on same firewall and same server w/ exactly same scheme (DNAT). Only difference on firewall is port number 993 or 4433.

**Comment by naoyukimori** [comment]
No update, close once. Reopen if needed or any update arise.

**Comment by naoyukimori** [comment]
Finally, resolved!
Yes, it was OS's builtin firewall issue.

It was weird for me that only MPS traffic blocked while HTTPS web works fine.

Reason was:
On HTTPS/4430 access, it's fine because there's L7 reverse proxy in the middle, the proxy terminate session from outside, then create new session between proxy and MeshCentral HTTPS server over same L2 doamin. i.e. packets came into MeshCentral HTTPS is originated from proxy where sits same L2 domain, and it would not blocked by OS's firewall. Works fine. Hair pin NAT is same case w/ this.

On the other hands, MPS traffic come directly from outside, router just L3 forward. So from MeshCentral MPS server point of view, packets came from another L2 domain, it blocked by OS's default firewall rule that reject incoming packets other than same L2 domain.

I really appreciate  @Ylianst for giving insight and idea, that help me identify root cause.

**Comment by naoyukimori** [comment]
@Ylianst , pls add tag as "Fixed" if you need.

**Comment by si458** [comment]
@amoljagdalepucsd, please open an issue and stick to that issue.
Don't ask on every issue under the sun for others to help.

I noted u are using tlsoffload. Are u also using ur reverse proxy to forward the amt port to the meshcentral server? Or have u just let the amtport directly accessible to the Internet?

If u use a reverseproxy u might need to set the amt tlsoffload too

```
"mpsTlsOffload": {
          "type": "boolean",
          "default": false,
          "description": "When set to true, indicate that TLS is being performed by a device in front of MeshCentral."
        },
```
