### ISSUE TITLE
SMTP session start TLS while "tls" is set to false. 

### ISSUE THREAD

**Issue by bcnx** [Ylianst/MeshCentral#5233]
Hi,

I can't get connect to my local Postfix instance:

`
MeshCentral HTTPS server running on meshcentral.bnt.solutions:443.
SMTP mail server 127.0.0.1 failed: {"code":"ESOCKET","command":"CONN"}
`

While investigating the issue with tcpdump, I see that a TLS sessions is asked for:

`
18:50:31.222417 IP localhost.41578 > localhost.smtp: Flags [.], ack 59, win 512, options [nop,nop,TS val 1180884261 ecr 1180884261], length 0
18:50:31.269972 IP localhost.41578 > localhost.smtp: Flags [P.], seq 1:33, ack 59, win 512, options [nop,nop,TS val 1180884308 ecr 1180884261], length 32: SMTP: EHLO meshcentral.bnt.solutions
18:50:31.269987 IP localhost.smtp > localhost.41578: Flags [.], ack 33, win 512, options [nop,nop,TS val 1180884308 ecr 1180884308], length 0
18:50:31.270085 IP localhost.smtp > localhost.41578: Flags [P.], seq 59:235, ack 33, win 512, options [nop,nop,TS val 1180884308 ecr 1180884308], length 176: SMTP: 250-meshcentral.bnt.solutions
18:50:31.272123 IP localhost.41578 > localhost.smtp: Flags [.], ack 235, win 511, options [nop,nop,TS val 1180884310 ecr 1180884308], length 0
18:50:31.273493 IP localhost.41578 > localhost.smtp: Flags [P.], seq 33:43, ack 235, win 512, options [nop,nop,TS val 1180884312 ecr 1180884308], length 10: SMTP: STARTTLS
18:50:31.273553 IP localhost.smtp > localhost.41578: Flags [P.], seq 235:265, ack 43, win 512, options [nop,nop,TS val 1180884312 ecr 1180884312], length 30: SMTP: 220 2.0.0 Ready to start TLS
`

However, config.json I have:

`
  "smtp": {
    "host": "127.0.0.1",
    "port": 25,
    "tls": false,
    "from": "meshcentral@bnt.solutions"
  }
`

How is this possible?

**Comment by bcnx** [comment]
OK, fixed it: I had to disable TLS on my Postfix, I assume TLS was first negociatede and now not anymore. As it is a localhost connection TLS is of lesser importance,

BC

**Comment by Ylianst** [comment]
Note that when you specify TLS false like this:

```
"smtp": { "host": "127.0.0.1", "port": 25, "tls": false, "from": "meshcentral@bnt.solutions" }
```

It only tells MeshCentral to not start the session with TLS. Often times SMTP will then upgrade the session to TLS using it's own messages. So, `"tls": false` does not mean that your session is not encrypted with TLS, just that MeshCentral with start without it and follow the instructions of your SMTP server to upgrade to TLS if needed.
